{
  "$schema": "https://json-schema.org/draft/2020-12/schema",
  "$id": "https://koikoi4x.local/schemas/deck-package-v1.schema.json",
  "title": "KoiKoi4x Deck Package v1",
  "type": "object",
  "additionalProperties": false,
  "required": [
    "formatVersion",
    "id",
    "version",
    "name",
    "author",
    "license",
    "extends",
    "framePolicy",
    "cards"
  ],
  "properties": {
    "formatVersion": {
      "const": 1
    },
    "id": {
      "type": "string",
      "pattern": "^[a-z0-9]+(?:-[a-z0-9]+)*$"
    },
    "version": {
      "type": "string",
      "pattern": "^\\d+\\.\\d+\\.\\d+(?:-[0-9A-Za-z.-]+)?$"
    },
    "name": {
      "type": "string",
      "pattern": "\\S"
    },
    "author": {
      "type": "string",
      "pattern": "\\S"
    },
    "license": {
      "type": "string",
      "pattern": "\\S"
    },
    "extends": {
      "anyOf": [
        {
          "type": "null"
        },
        {
          "type": "string",
          "pattern": "^[a-z0-9]+(?:-[a-z0-9]+)*$"
        }
      ]
    },
    "framePolicy": {
      "const": "game"
    },
    "sourceDefaults": {
      "type": "object",
      "additionalProperties": false,
      "required": [
        "mode",
        "fit",
        "focusX",
        "focusY"
      ],
      "properties": {
        "mode": {
          "const": "auto"
        },
        "fit": {
          "enum": [
            "cover",
            "contain"
          ]
        },
        "focusX": {
          "type": "number",
          "minimum": 0,
          "maximum": 1
        },
        "focusY": {
          "type": "number",
          "minimum": 0,
          "maximum": 1
        }
      }
    },
    "cards": {
      "type": "object",
      "propertyNames": {
        "enum": [
          "january-crane",
          "january-red-text-scroll",
          "january-pine-plain-a",
          "january-pine-plain-b",
          "february-bush-warbler",
          "february-red-text-scroll",
          "february-plum-plain-a",
          "february-plum-plain-b",
          "march-curtain",
          "march-red-text-scroll",
          "march-cherry-plain-a",
          "march-cherry-plain-b",
          "april-cuckoo",
          "april-red-scroll",
          "april-wisteria-plain-a",
          "april-wisteria-plain-b",
          "may-bridge",
          "may-red-scroll",
          "may-iris-plain-a",
          "may-iris-plain-b",
          "june-butterfly",
          "june-blue-scroll",
          "june-peony-plain-a",
          "june-peony-plain-b",
          "july-boar",
          "july-red-scroll",
          "july-bush-clover-plain-a",
          "july-bush-clover-plain-b",
          "august-moon",
          "august-geese",
          "august-pampas-plain-a",
          "august-pampas-plain-b",
          "september-sake-cup",
          "september-blue-scroll",
          "september-chrysanthemum-plain-a",
          "september-chrysanthemum-plain-b",
          "october-deer",
          "october-blue-scroll",
          "october-maple-plain-a",
          "october-maple-plain-b",
          "november-rain",
          "november-swallow",
          "november-red-scroll",
          "november-willow-plain",
          "december-phoenix",
          "december-paulownia-plain-a",
          "december-paulownia-plain-b",
          "december-paulownia-plain-c"
        ]
      },
      "additionalProperties": {
        "type": "object",
        "additionalProperties": false,
        "required": [
          "file"
        ],
        "properties": {
          "file": {
            "type": "string",
            "pattern": "^source/(?!\\.{1,2}(?:/|$))(?!.*\\/\\.{1,2}(?:/|$))(?!.*\\/\\/)(?!.*[\\\\?#])[^/]+(?:/[^/]+)*\\.(?:[pP][nN][gG]|[jJ][pP][eE]?[gG]|[wW][eE][bB][pP])$"
          }
        }
      }
    },
    "backs": {
      "type": "object",
      "additionalProperties": false,
      "properties": {
        "default": {
          "type": "string",
          "pattern": "^source/(?!\\.{1,2}(?:/|$))(?!.*\\/\\.{1,2}(?:/|$))(?!.*\\/\\/)(?!.*[\\\\?#])[^/]+(?:/[^/]+)*\\.(?:[pP][nN][gG]|[jJ][pP][eE]?[gG]|[wW][eE][bB][pP])$"
        }
      }
    },
    "preview": {
      "type": "object",
      "additionalProperties": false,
      "required": [
        "featuredCardIds"
      ],
      "properties": {
        "thumbnail": {
          "type": "string",
          "pattern": "^preview/(?!\\.{1,2}(?:/|$))(?!.*\\/\\.{1,2}(?:/|$))(?!.*\\/\\/)(?!.*[\\\\?#])[^/]+(?:/[^/]+)*\\.(?:[pP][nN][gG]|[jJ][pP][eE]?[gG]|[wW][eE][bB][pP])$"
        },
        "showcase": {
          "type": "string",
          "pattern": "^preview/(?!\\.{1,2}(?:/|$))(?!.*\\/\\.{1,2}(?:/|$))(?!.*\\/\\/)(?!.*[\\\\?#])[^/]+(?:/[^/]+)*\\.(?:[pP][nN][gG]|[jJ][pP][eE]?[gG]|[wW][eE][bB][pP])$"
        },
        "featuredCardIds": {
          "type": "array",
          "uniqueItems": true,
          "items": {
            "enum": [
              "january-crane",
              "january-red-text-scroll",
              "january-pine-plain-a",
              "january-pine-plain-b",
              "february-bush-warbler",
              "february-red-text-scroll",
              "february-plum-plain-a",
              "february-plum-plain-b",
              "march-curtain",
              "march-red-text-scroll",
              "march-cherry-plain-a",
              "march-cherry-plain-b",
              "april-cuckoo",
              "april-red-scroll",
              "april-wisteria-plain-a",
              "april-wisteria-plain-b",
              "may-bridge",
              "may-red-scroll",
              "may-iris-plain-a",
              "may-iris-plain-b",
              "june-butterfly",
              "june-blue-scroll",
              "june-peony-plain-a",
              "june-peony-plain-b",
              "july-boar",
              "july-red-scroll",
              "july-bush-clover-plain-a",
              "july-bush-clover-plain-b",
              "august-moon",
              "august-geese",
              "august-pampas-plain-a",
              "august-pampas-plain-b",
              "september-sake-cup",
              "september-blue-scroll",
              "september-chrysanthemum-plain-a",
              "september-chrysanthemum-plain-b",
              "october-deer",
              "october-blue-scroll",
              "october-maple-plain-a",
              "october-maple-plain-b",
              "november-rain",
              "november-swallow",
              "november-red-scroll",
              "november-willow-plain",
              "december-phoenix",
              "december-paulownia-plain-a",
              "december-paulownia-plain-b",
              "december-paulownia-plain-c"
            ]
          }
        }
      }
    },
    "qualityExceptions": {
      "type": "object",
      "propertyNames": {
        "enum": [
          "january-crane",
          "january-red-text-scroll",
          "january-pine-plain-a",
          "january-pine-plain-b",
          "february-bush-warbler",
          "february-red-text-scroll",
          "february-plum-plain-a",
          "february-plum-plain-b",
          "march-curtain",
          "march-red-text-scroll",
          "march-cherry-plain-a",
          "march-cherry-plain-b",
          "april-cuckoo",
          "april-red-scroll",
          "april-wisteria-plain-a",
          "april-wisteria-plain-b",
          "may-bridge",
          "may-red-scroll",
          "may-iris-plain-a",
          "may-iris-plain-b",
          "june-butterfly",
          "june-blue-scroll",
          "june-peony-plain-a",
          "june-peony-plain-b",
          "july-boar",
          "july-red-scroll",
          "july-bush-clover-plain-a",
          "july-bush-clover-plain-b",
          "august-moon",
          "august-geese",
          "august-pampas-plain-a",
          "august-pampas-plain-b",
          "september-sake-cup",
          "september-blue-scroll",
          "september-chrysanthemum-plain-a",
          "september-chrysanthemum-plain-b",
          "october-deer",
          "october-blue-scroll",
          "october-maple-plain-a",
          "october-maple-plain-b",
          "november-rain",
          "november-swallow",
          "november-red-scroll",
          "november-willow-plain",
          "december-phoenix",
          "december-paulownia-plain-a",
          "december-paulownia-plain-b",
          "december-paulownia-plain-c"
        ]
      },
      "additionalProperties": {
        "type": "object",
        "additionalProperties": false,
        "required": [
          "allowBelowReleaseMinimum",
          "approvedBy",
          "approvedOn",
          "reason"
        ],
        "properties": {
          "allowBelowReleaseMinimum": {
            "const": true
          },
          "approvedBy": {
            "type": "string",
            "pattern": "\\S"
          },
          "approvedOn": {
            "type": "string",
            "pattern": "\\S"
          },
          "reason": {
            "type": "string",
            "pattern": "\\S"
          }
        }
      }
    }
  },
  "$defs": {
    "artSpecVersion": {
      "const": 1
    }
  }
}
