{
  "formatVersion": 1,
  "id": "new-primary-deck",
  "version": "0.1.0",
  "name": "New Primary Deck",
  "author": "KoiKoi4x Project",
  "license": "Technical Phase 0D placeholders; finished-art license pending",
  "extends": null,
  "framePolicy": "game",
  "sourceDefaults": {
    "mode": "auto",
    "fit": "cover",
    "focusX": 0.5,
    "focusY": 0.5
  },
  "cards": {
    "january-crane": { "file": "source/january-crane.png" },
    "january-red-text-scroll": { "file": "source/january-red-text-scroll.png" },
    "january-pine-plain-a": { "file": "source/january-pine-plain-a.png" },
    "january-pine-plain-b": { "file": "source/january-pine-plain-b.png" },
    "february-bush-warbler": { "file": "source/february-bush-warbler.png" },
    "february-red-text-scroll": { "file": "source/february-red-text-scroll.png" },
    "february-plum-plain-a": { "file": "source/february-plum-plain-a.png" },
    "february-plum-plain-b": { "file": "source/february-plum-plain-b.png" },
    "march-curtain": { "file": "source/march-curtain.png" },
    "march-red-text-scroll": { "file": "source/march-red-text-scroll.png" },
    "march-cherry-plain-a": { "file": "source/march-cherry-plain-a.png" },
    "march-cherry-plain-b": { "file": "source/march-cherry-plain-b.png" },
    "april-cuckoo": { "file": "source/april-cuckoo.png" },
    "april-red-scroll": { "file": "source/april-red-scroll.png" },
    "april-wisteria-plain-a": { "file": "source/april-wisteria-plain-a.png" },
    "april-wisteria-plain-b": { "file": "source/april-wisteria-plain-b.png" },
    "may-bridge": { "file": "source/may-bridge.png" },
    "may-red-scroll": { "file": "source/may-red-scroll.png" },
    "may-iris-plain-a": { "file": "source/may-iris-plain-a.png" },
    "may-iris-plain-b": { "file": "source/may-iris-plain-b.png" },
    "june-butterfly": { "file": "source/june-butterfly.png" },
    "june-blue-scroll": { "file": "source/june-blue-scroll.png" },
    "june-peony-plain-a": { "file": "source/june-peony-plain-a.png" },
    "june-peony-plain-b": { "file": "source/june-peony-plain-b.png" },
    "july-boar": { "file": "source/july-boar.png" },
    "july-red-scroll": { "file": "source/july-red-scroll.png" },
    "july-bush-clover-plain-a": { "file": "source/july-bush-clover-plain-a.png" },
    "july-bush-clover-plain-b": { "file": "source/july-bush-clover-plain-b.png" },
    "august-moon": { "file": "source/august-moon.png" },
    "august-geese": { "file": "source/august-geese.png" },
    "august-pampas-plain-a": { "file": "source/august-pampas-plain-a.png" },
    "august-pampas-plain-b": { "file": "source/august-pampas-plain-b.png" },
    "september-sake-cup": { "file": "source/september-sake-cup.png" },
    "september-blue-scroll": { "file": "source/september-blue-scroll.png" },
    "september-chrysanthemum-plain-a": { "file": "source/september-chrysanthemum-plain-a.png" },
    "september-chrysanthemum-plain-b": { "file": "source/september-chrysanthemum-plain-b.png" },
    "october-deer": { "file": "source/october-deer.png" },
    "october-blue-scroll": { "file": "source/october-blue-scroll.png" },
    "october-maple-plain-a": { "file": "source/october-maple-plain-a.png" },
    "october-maple-plain-b": { "file": "source/october-maple-plain-b.png" },
    "november-rain": { "file": "source/november-rain.png" },
    "november-swallow": { "file": "source/november-swallow.png" },
    "november-red-scroll": { "file": "source/november-red-scroll.png" },
    "november-willow-plain": { "file": "source/november-willow-plain.png" },
    "december-phoenix": { "file": "source/december-phoenix.png" },
    "december-paulownia-plain-a": { "file": "source/december-paulownia-plain-a.png" },
    "december-paulownia-plain-b": { "file": "source/december-paulownia-plain-b.png" },
    "december-paulownia-plain-c": { "file": "source/december-paulownia-plain-c.png" }
  },
  "backs": {
    "default": "source/card-back.png"
  },
  "preview": {
    "featuredCardIds": [
      "november-rain",
      "september-sake-cup",
      "december-phoenix",
      "january-pine-plain-a"
    ]
  }
}
